Name,Category,Timing,Starting,Growing,Harvest
Chervil,Herb,"Start seeds indoors or direct sow in spring. Direct sow in summer and protect plants from midday sun for a winter crop – chervil is quite hardy. Keep transplanting to a minimum, as chervil develops a delicate taproot that does not respond well to disturbance.","Sow seeds 5mm-1cm (¼-½”) deep, and space plants 23-30cm (9-12″) apart.","Chervil plants will be ready for cutting 6-8 weeks after sowing. It’s probably best to grow chervil in relatively damp soil in partial shade, as plants will bolt in hot mid-summer weather. Transplanting may also trigger bolting. Cover with a cloche in winter, and it will just keep growing until it blooms the following spring.","Begin harvesting as needed 6-8 weeks after sowing, or when plants are 10cm (4″) tall. Drying kills nearly all the flavour of chervil leaves, so freezing is best for long term storage."
Chives,Herb,"Start indoors from late winter through mid-spring, and transplant or direct sow once the soil has warmed in late spring. Optimal soil temperature for germination: 19°C (65°F).","Sow 5mm-1cm (¼-½”) deep and keep moist until germination. If starting indoors, use bottom heat and plant 10-15 seeds per cell in a 72 cell plug tray. Transplant either into containers or into the garden once the soil has warmed up. Space clumps 15cm (6″) apart.","Clumps of chives spread to about 30cm (12″) across. They should be divided at that point and replanted to stand 30cm (12″) apart or broken up for container planting. Remove flower stems before they open to increase foliage production. Keep chives watered evenly throughout the season. For a winter crop, try digging up a small clump after the foliage dies back in the fall. Plant this in a container using loamy potting mix, and bring indoors to a warm, and very bright windowsill.","The whole plant can be cut down to 4cm (2″) from the ground. Use scissors and take as much as needed. Chives don’t dehydrate well, so use fresh portions regularly. The flowers can be used in salads or to flavour vinegars."
Cilantro,Herb,Direct sow from just after the last frost date to late spring. Direct sow in the fall under cover for a winter crop. Optimal soil temperature for germination: 15°C (60°F). Seeds should sprout in 5-10 days.,"Sow 2cm (1″) deep in short rows. Thin seedlings to stand 5-10cm (2-4″) apart if harvesting leaves. If growing for seed, allow 23cm (9″) between plants.","Cilantro is tricky because several factors can cause it to bolt. Avoid transplanting for this reason, and avoid hot conditions as well as too much moisture. It does best in light, well-drained soil in partial shade, in relatively dry conditions. This is easy to achieve beneath a cloche in winter, where cilantro will thrive. Once it blooms, the seeds ripen suddenly, in only a couple of days, so care should be taken to prevent self sowing or simply losing those useful seeds. GerminationUsual seed life: 3 years.","Pick young leaves once they have reached about 10cm (4″) in height. The flavour, though intense when fresh, diminishes quickly when dried or cooked, so always add cilantro just before serving. Try freezing it in ice cube trays with water. The stems and roots are also full of flavour. Harvest the seeds by sticking 6 or 8 seed heads in a paper bag and hanging it up somewhere airy, away from direct sunlight. The bag will catch the seeds as they ripen and fall out."
Culantro,Herb,"Start the seeds in CowPots or medium sized coir pots. Culantro is a biennial plant with a central taproot, so it does not transplant well. The strategy is to transplant its whole root system as needed. Start seeds indoors about eight weeks before the last frost date. That’s early February on the west coast. This tropical herb requires warm soil. Optimal temperature for germination: 26°C (80°F). Seeds should sprout in 14-28 days.","Sow the tiny seeds on the surface of pre-moistened, sterilized seed starting mix. Using bottom heat speeds germination. Do not transplant until night time temperatures are consistently 10°C (50°F) or higher. Keep the planting medium quite moist. Aim for an ultimate spacing of one plant per one gallon pot, or three plants per five gallon pot.","Rich, moist, well-drained soil in a warm location is best. Culantro thrives in full sun, but there seems to be some consensus among growers that it will be more productive over a longer period if grown in partial shade. The leaves grow larger and more tender this way. GerminationUsual seed life: 2 years. Using fresh seed each year is recommended.","Typically culantro is used as a fresh herb, cutting individual leaves from the plant (or row) as needed. If frost is expected or plants appear to be bolting, harvest at once, and allow the leaves to dry completely with the tap root attached. The leaves retain their flavour surprisingly well. It can also be chopped and frozen in water in ice cube trays like basil, but this seems to diminish the flavour a little."
Cumin,Herb,"Cumin needs a long hot season to produce seeds. Start indoors four weeks before the last frost date, and transplant outside once temperatures are steadily above 15°C (60°F). Ideal temperature for germination: 20-30°C (68-86°F), so use bottom heat. Seeds should sprout in 7-14 days.",Sow 5mm (¼”) deep. Transplant at a spacing of 10cm (4″).,"Cumin needs approximately 120 days to maturity from the sowing date to produce viable seeds. It is an annual member of the carrot family, and produces umbelliferous flowers that are highly attractive to beneficial garden insect predators. Flowering begins mid-summer. GerminationUsual seed life: 2 years.","Cut the seed heads to dry indoors as late in the season as possible, or as soon as seeds can be seen to fall from the seed head."
Dill,Herb,"Direct sow late spring through summer, or sow when cucumbers are transplanted, to coincide maturity for pickling. Dill tends to bolt if transplanted, so it is best direct sown. Stagger the harvest by sowing every 2-3 weeks for a constant supply of fresh leaves. Optimal soil temperature for germination: 15-21°C (60-70°F). Seeds should germinate in 10-21 days.",Dill seeds need some light to germinate. Sow seeds no more than 5mm (¼”) deep in rows 45cm (18″) apart. Thin the plants to stand at least 15cm (6″) apart.,"Ideal pH: 5.0-7.0. Grow in moderately rich soil in full sun. Water and feed regularly, and stop any overhead watering once plants are 60cm (24″) tall to prevent issues with mildew forming on the leaves. GerminationUsual seed life: 3 years.","Begin harvesting the tasty leaves once plants reach 15cm (6″) tall. About 12 weeks after sprouting the seed heads begin to form. When the first seeds have turned brown, cut the whole head and hang it upside down for the drying seeds to fall out into trays or paper bags. Dill leaf loses most of its flavour when dried, so freeze it in ice cube trays filled with water for use all winter."
Lavender,Herb,"Lavender germinates most evenly if seeds can be collected in the autumn and sown on the surface of a seed tray with bottom heat maintaining 4-10°C (40-50°F). The seedlings are then overwintered in a cool greenhouse or cold frame with good ventilation. Seedlings can then be potted on as needed.Another method is to start the seeds indoors in winter, planting a few seeds in a few pots with sterilized seed starting mix. Dampen the mix, press the seeds into the surface, insert the pots into plastic bags, and put them in the freezer for about a week. Let them come to room temperature on their own, and then use bottom heat as indicated above.","Avoid using a plastic lid or covering, as this will keep the soil more moist than needed. Barely cover the seed, as they germinates in 14-21 days in warm soil. Do not use a plastic lid or covering because this will make the surface of the soil too moist. If watering is necessary, water from below. If germination is low after 3-4 weeks, lower the temperature to 5-10°C (40-50°F) for 2 weeks, then raise it again. Pot up the tiny seedlings and grow them on in a protected greenhouse or windowsill to set into the garden in the spring.","Lavender prefers full sun and well drained, fertile soil. Trim plants back hard in spring, just as new growth starts – but never prune back into the woody part of the stems. This will give a rush of even growth for the first leaves and bloom. Cut back again in early autumn, but again – never into old wood.","Gather the flowers just as they open. Dry on open trays, or by hanging in small bunches. Pick the leaves anytime to use fresh, or if dehydrating lavender leaves, gather before flowering starts."
Lemon Balm,Herb,"Start indoors 6 to 8 weeks before last frost, and transplant out or direct sow once day time temperatures are steadily above 10°C (50°F).","Barely cover the tiny seeds. Use a sterilized potting soil, and keep watering to an absolute minimum – just enough to keep the medium from drying out. Germination takes 10-14 days. Transplant at a spacing of 45cm (18″) into the garden.","Choose a shady spot or a location where plants can be protected from midday sun. Lemon balm prefers a fertile, moist soil in a cooler part of the garden. Plants grown in partial shade will be larger and more succulent than those exposed to full sun.",Pick leaves throughout the summer for fresh use. The aroma is rapidly lost when dried or stored.
Lovage,Herb,"Start indoors in spring or direct sow in the fall. If starting indoors, try to maintain a soil temperature of 15°C (60°F). Once seedlings are big enough to handle, harden them off before transplanting to the garden.","Sow seeds 5mm (¼”) deep, three or four seeds per pot, and thin to the strongest seedling. Germination takes 10-14 days. Keep soil moist until they are established, and transplant out at least 60cm (24″) apart.","Choose the site for your lovage with care, as they are long lived perennials, and they grow tall. They will tolerate partial shade to full sun. Lovage develops a long taproot, so cultivate the bed deeply, and add well rotted manure. Consider grouping lovage together with other perennial food plants like asparagus and rhubarb in a permanent bed. Allow for a spread of at least 1m (3′).","The leaves of lovage can part a wonderful meaty flavour to vegetable soups, stews and stocks. After the herb has flowered, the leaves develop a bitter taste, so it is best harvested in early summer. The fresh leaves can be frozen in ice cubes for winter use. Chop the leaves finely and distribute them in ice cube trays, then cover with water. When the cubes are frozen, put them in zip-top bags."
Mint,Herb,"Sow indoors 8-10 weeks before last frost, or direct sow in late spring. Seeds should sprout in 10-16 days. Bottom heat will speed germination.",Sow seeds no more than 5mm (¼”) deep in moist soil. Space plants 45-60cm (18-24″) apart.,"Mint spreads in the garden with gusto via a vigorous root system, so it may be preferable to confine it to planters on the balcony or in a raised bed. Prune plants back hard in early summer to promote good top growth. Bring some inside to grow in a small container over winter to grow on a brightly lit windowsill.","Clip leaves or branches as needed throughout the year. Mint is so hardy and tough that it will grow right back. Dry the leaves and flowers for peppermint tea, or use them fresh. The flowers are edible and bring distinctive character to salads and sweets."
Oregano,Herb,Start indoors in plug trays from late winter to mid-spring. Starting indoors is more reliable than direct sowing. Use bottom heat to achieve a constant soil temperature of 15°C (60°F) for best results. Germination occurs in 7 to 14 days.,"Oregano seeds are dust-like, so handle them with care. Prepare containers or plug trays using sterilized seed starting mix, and water the soil. Then try to evenly distribute the tiny seeds on the surface of the soil. Do not bury them. Using bottom heat will improve the overall success rate. As seedlings grow, keep soil on the dry side. Pot on as necessary or transplant to the garden in late spring to early summer.","Grow in a sunny and warm spot. Aim for 25cm (10″) between plants. Cut plants back after flowering to prevent them from getting straggly. As autumn approaches, divide some to bring inside over winter. Cut back the year’s growth to about 6cm (2½”) from the soil.",Pick the leaves throughout the season as needed. Oregano leaves can be dried or frozen. Store dried leaves or whole stalks in air tight containers away from bright light.
Parsley,Herb,,"If starting indoors, sow seeds 1cm (½”) deep, in sterilized seed starting mix, in peat pots or plug trays. Like its cousins dill and cilantro, parsley develops a taproot that does better if left undisturbed. Sow outdoors in drills 3cm (1¼”) deep, spaced 8cm (3″) apart. Thin final plants to 15cm (6″) apart.","Grow parsley in a deeply dug bed. Add a generous amount of rotted manure or finished compost to the bed several weeks in advance, or the previous fall. For summer crops, aim to grow plants in a place where they will receive some shade during the day – either on the east or west side of a structure or fence works well. For winter crops, start new seeds in late summer and transplant out to a warm, sunny location by September. Parsley will grow all winter (in mild areas) if cloche protection is provided.","Cut individual sprigs from the outside of the plant or the whole plant as needed. Sprigs can be dried in the food dehydrator. Chop sprigs into the portions that your favourite recipes call for, place into an ice cube tray and add water to cover. When frozen, bag and store until needed. This keeps the parsley fresh for months."
Rosemary,Herb,"Sow indoors from late winter to early spring. Transplant or direct sow starting in late spring, once soil has warmed. Starting indoors is more reliable. Use bottom heat to maintain an optimal soil temperature of 27-32°C (80-90°F).","Most nurseries grow rosemary from cuttings, not seeds. Germination is notoriously low, so plant more seeds than needed. Sow them barely covered with sterilized seed starting mix over bottom heat. Once germinated, rosemary is highly prone to damping off, so keep watering to a minimum, provide bright light, and ventilation. Keep each plant in its own pot for the first winter and offer them protection from severe cold. Transplant to the garden the following spring at a spacing of 60-90cm (24-36″).","If growing rosemary in containers, provide monthly feedings of liquid fertilizer. Keep watered in hot weather. Mulch around all rosemary plants as cold weather approaches. If their roots freeze in times of hard frost, the plants will die.","Harvest individual leaves by pulling them off the plant. Harvest branches or stems for drying by cutting with a clean, very sharp knife. Scissors may crush the plant’s tissues at the cut end."
Sage,Herb,"Start indoors mid-winter to mid-spring. Transplant out or direct sow starting late spring. Starting indoors may be more reliable, particularly if using bottom heat and maintaining optimal soil temperature at 15-21°C (60-70°F). Seeds should sprout in 2 to 3 weeks.","Sow seeds 3mm (1/8″) deep, and keep soil just moist, not wet. Thin or transplant to 45-60cm (18-24″) apart.","In spring, trim established plants back by a third to encourage new growth. Once the flowers have finished in June/early July, trim the plants back again. A second bloom sometimes follows, and this pruning will keep plants bushy and compact. After a few years, sage bushes can become quite large. Keep in check by pruning.",
Savory,Herb,Sow the very tiny seeds indoors about 4-6 weeks before the last frost. They should sprout in 10-15 days.,"Sow seeds on the surface of prepared starting mix. Do not bury them as they need light to germinate. Don’t bother using bottom heat, as the seeds will sprout well without it. When seedlings are large enough to handle, delicately pot them on or transplant out to the herb garden once all risk of frost is past. Both varieties benefit from careful hardening off to reduce transplant shock.",,
Shiso,Herb,"Start indoors in early spring, a couple of weeks after the last frost date, or direct sow outdoors in late spring, once night time temperatures are steadily above 8°C (45°F).","If starting indoors, use equal parts sterilized seed starting mix to perlite. Mix well and add to seed trays with domes. Use bottom heat from a  to maintain a soil temperature of 20°C (70°F). Seeds should germinate in 7 to 14 days. Be careful not to over-water, particularly once seeds have germinated, as the seedlings are prone to damping off. Remove the dome at germination, but maintain bottom heat until seedlings are large enough to pot on into larger containers.Alternatively, direct sow outdoors into well-drained garden soil. Seeds should germinate in 14 to 20 days.","Shiso does best in full sun to partial shade, in fertile, well-drained soil. Allow transplants to become established, and then grow as you would basil — pinch growing tips regularly to produce bushier plants with more leaves. Water regularly, more so in hot weather. If growing in containers, mix equal parts potting soil and composted fine bark. Orchid bark works well.","Pick leaves as needed throughout the summer, and harvest the flowering tops in late summer. As autumn approaches, harvest the seeds for planting next spring."
Stevia,Herb,"Sow indoors 8-10 weeks before last frost, or direct sow in late spring. Seeds should sprout in 10-16 days.","Sow seeds on the surface of damp, sterile seed mix, and use bottom heat. Warmth and bright light are necessary for germination. Be advised that germination is challenging. The germination rate shown on our packaging reflects laboratory conditions. Without the use of bottom heat, few or none of the seeds will germinate. We highly recommend using a heat mat.","Grow using the same methods as growing basil. Grow in well drained soil in a warm spot in the garden, or in large containers in full sun. Water regularly in hot, dry weather. In very hot climates, Stevia benefits from afternoon shade. Space plants 60cm (24"") apart, and pinch growing tips once or twice to encourage bushy growth.","Clip leaves or branches as needed throughout summer. The leaves dry fairly well for fall and winter use as an all purpose, low calorie sweetener."
Tarragon,Herb,"Sow indoors 6-8 weeks before last frost, or direct sow 2 weeks after last frost. If starting indoors, just cover the seeds with vermiculite and provide a soil temperature of 21-25°C (70-75°F). Seeds should sprout in 4-14 days at that temperature.","The seedlings are somewhat prone to damping off. As a precaution, just cover the small seeds with vermiculite, water from below, and provide ventilation in the room. Space plants in the garden 30-45cm (12-18″) apart.","Pinch the growing tips to encourage branching. Edible flowers are borne in abundance once the summer heats up. This fast growing herb requires little care, but it does appreciate good drainage.",Pick leaves and flowers to steep as tea or as a substitute for traditional tarragon at any time during the summer. A yellow dye can be created from the flowers of this plant. The dried plant was traditionally burned to repel insects.
Thyme,Vegetable,"Sow indoors late winter to mid-spring. Transplant out once soil begins to warm, or direct sow late May through June. Ideal soil temperature for germination: 15-21°C (60-70°F).","Sow the dust-like seeds on the surface of dampened, sterilized seed starting mix under bright light with bottom heat. Keep watering to a minimum, as thyme seedlings are prone to damping off. When seedlings are large enough, harden them off and transplant to the garden or to containers, spacing them at 23-38cm (9-15″) apart.","Trim plants back after flowering to encourage bushy growth. Protect container-grown plants from cold as winter approaches, and water only as necessary. Damp, cold soil will kill thyme.","Fresh thyme leaves can be harvested at any time of the year as long as the plants are established. Prune back any dead branches. Whole stems/branches can be clipped and dried whole, or individual leaves can be left to dry in a dark, airy spot for long term storage."
Artichoke,Vegetable,"Start indoors in late winter, four to six weeks before the last frost date. Keep seedlings under bright lights.","Sow two seeds per pot, 5mm (¼”) deep. Keep moist in a warm place until seeds germinate in 10 to 21 days. Transplant seedlings into the garden 2 weeks after the last average frost date for your area. Artichokes need a cool period (250 hours — approximately 10 to 11 days) below 10°C (50°F) to induce flowering in the first year, but will not survive hard frost. Space plants 1m (3′) apart. Seeds can also be germinated between damp sheets of paper towel.","Ideal pH: 5.6-6.6. Select a sunny, sheltered location with well-draining soil. Dig in lots of compost or rotted manure and add 1/2 to 1 cup of  per plant. Approximately two weeks before the last frost date (or if hard frost is forecast) cut the plants back to 15cm (6″) tall, and mulch well with straw, soil, leaves, or burlap, to keep the roots from freezing. Uncover after the last frost date. GerminationDays to maturity: From transplant.In optimum conditions at least 70% of seeds will germinate. Usual seed life: 1 year.",Cut individual flowers before they start to open in late summer.
Arugula,Vegetable,"Direct sow every 3 weeks from mid-March to April and again in September for a fall/winter crop. Arugula is a productive, cool season, annual salad green that works best in spring and fall, and can be managed all winter under cloche protection where winters are mild. In hot weather, arugula tends to bolt and go to seed. Optimal soil temperature for germination: 4-12°C (40-50°F).",Sow no more than 5mm (¼”) deep in well drained soil in full sun. Thin seedlings to 10-15cm (4-6″) apart in rows 45-60cm (18-24″) apart. Overcrowded plants will bolt earlier. Seeds germinate in 4-8 days.,Ideal pH: 6.5-7.0. In optimum conditions at least 75% of seeds will germinate. Keep moist until germinated and then just keep the area weeded.,Harvest with scissors. Use as a cut & come again crop. Baby leaves are mild and tender.
Bean,Vegetable,"Direct sow before the first frost date in mild winter areas. Direct sow late winter to mid-spring in other areas (tall, soft plants won’t withstand winter well). Optimal soil temperature: 10-21°C (50-70°F). Enrich the soil with compost prior to planting.","Use a broad bean or combination inoculant to provide a source of nitrogen. Sow seed 5cm (2″) deep, 15cm (6″) apart in double rows. Each set of double rows should be 1m (3’) apart. Germination takes 10-14 days, depending on conditions.","Ideal pH: 6.0-6.5.Keep overwintered plants weeded. Provide stakes or strings between rows to stop plants from falling over. GerminationDays to maturity: From direct sowing.In optimum conditions at least 75% of seeds will germinate. Usual seed life: 2-3 years. Per 100′ row: 450 seeds, per acre: 98M seeds.","Pick when the pods appear plump and begin to droop from the weight of the seeds. Shell (like peas) and cook or use in soup. For dried beans, wait until the pods start to shrivel."
Beets,Vegetable,"Direct sow 4 weeks after last frost to mid-summer. Beets will not produce roots if planted when the soil is too cold. Seeds will germinate in 5-12 days, depending on soil temperature. Optimal soil temperature: 10-26°C (50-80°F).","Sow 1cm (½”) deep, 5-10cm (2-4″) apart in rows 30-45cm (12-18″) apart.","Ideal pH: 6.0-6.8.For uniformly sized beets, thin carefully to 7-15cm (3-6″) apart when seedlings are 5cm (2″) tall. Eat any thinned plants, roots and all. Root size is controlled by spacing and variety. GerminationDays to maturity: From direct sowing.In optimum conditions at least 75% of seeds will germinate. Usual seed life: 3 years. Per 100′ row: 600-1M seeds, per acre: 436M seeds.","Harvest at any size. For the best flavour, pull the beets as soon as they have reached full-size. Eat the greens too! Store in the ground, or in moist peat or sand just above freezing."
