Name,Category,Timing,Starting,Growing,Harvest
Nemophilla,Flower,"Start indoors, in peat or coir pots, 6-8 weeks before planting out. It’s probably simpler to direct sow in early spring, when a chance of frost is still possible. In mild winter areas, seeds can also be direct sown in the fall. Ideal soil temperature for germination: 12°C (55°F). Seeds should sprout in 7-21 days.",Barely cover the tiny seeds. Aim for plant spacing at 10cm (4″). Tighter spacing is okay for this small species. ,"Cool, moist, light, well-drained soil is best. Grow in partial shade where summer soils get hot. Plants can die from excessive heat. Nemophila may self sow if conditions are right. ",
Nigella,Flower,"Try sowing indoors, in peat or coir pots, 6-8 weeks before planting out after last frost. Better luck may come from direct sowing outdoors 1-2 weeks before last frost when some risk of frost still exists, and then sow again every three weeks for the next 3 months. Otherwise, direct sow in the fall. Optimal soil temperature for germination: 18-21°C (65-70°F). Seeds should sprout in 8-15 days.",Just cover the small seeds. Aim for a final spacing of 20-30cm (8-12″).,"Nigella performs best in cooler growing areas, in ordinary, well-drained, pH-neutral soil. Fertilize and deadhead regularly, and water in long dry spells. It is easy to plant and grow Nigella seeds. Nigella may self sow, depending on conditions.",
Ornamental Grass,Flower,"Sow indoors in peat pots, 6-8 weeks before last frost. Transplant after frost at 30cm (12"") spacing. Or direct sow outdoors after last frost or in the autumn. Expect germination in 10-21 days.","Sow 5mm (1/8"") deep, and keep soil just moist.","This annual grass will grow in full sun to partial shade, in containers, raised beds, or in xeriscaping schemes. Make sure the soil is well drained and not that fertile. Once it is growing, it requires very little care. It is tolerant of drought and stress, and is non-competitive.",
Phacelia,Flower,There is no real need to start Phacelia indoors. Direct sow every couple of weeks from last frost to mid-June. This will produce a summer full of flowers and flowers full of pollinators. Seeds will germinate in 12-30 days.,"Sow 5mm (¼”) deep, and space or thin to 10-20cm (4-8″) apart.","Ordinary, well-drained garden soil is what makes Phacelia thrive. It will die back during a long, hot stretch of weather, so it’s ideal for the cooler seasons of spring and fall. Phacelia plants may self sow.",
Poppy,Flower,"Start perennial poppies outdoors in early spring, when some chance of frost is still a possibility. Start annual varieties outdoors at the same time in Zones 3-7. In Zones 8-10, the best bet is to direct sow in the fall.Poppies are famously difficult to transplant, so starting them indoors is not recommended. If absolutely necessary, use peat or coir pots, and maintain a soil temperature of 12°C (55°F). Seeds will sprout in 20-30 days.","Sow on the surface of the soil, or barely cover seeds. Thin to a minimum of 15cm (6″) apart.","Poppies are easy to grow and the self-sow with abandon, without becoming weedy. Simply pull up unwanted plants (an easy task) before they bloom, or better yet, let them tell you where they want to grow. They will thrive for years at a time in surprising spots, like a crack in the driveway. Other times, they simply won’t take, no matter how much you try. Keep them moderately well watered in hot, dry weather, and do not fertilize. Sow seeds in the fall or early winter. Thin plants to allow them some space, and keep the area weeded as plants grow larger. Grow this variety in full sun in well-drained, but ordinary garden soil. If spring and summer are cool and damp, or plants are over-crowded, expect smaller seed heads.",
Primrose,Flower,"Sow indoors 8-10 weeks before last frost in peat or coir pots to prevent root disturbance. That’s the third week in January to the first week in February on the coast. Otherwise direct sow the seeds in early spring, or autumn in mild winter areas. Seeds should germinate in 5-30 days.","Just cover the small seeds, and germinate at 18°-21°C (65°-70°F). Oenothera seeds require darkness to break dormancy.","Ideal pH: 5.5-7.0.Space plants 13-23cm (5-9″) apart. Plant in light, well drained soil. Sandy soil works well for this plant. Oenothera is tolerant of dry and is a good candidate for xeriscaping. In really fertile soil the foliage can be robust, but fewer flowers form. Top dress with fully composted manure in the spring. Provide irrigation during long hot spells, and cut the plants back by a third after flowering to keep them looking neat. Hot summer weather may cause the plants to briefly stop flowering. Powdery mildew sometimes appears in humid conditions.",
Prunella,Flower,"Sow indoors 8-10 weeks before last frost, or direct sow in late spring. Seeds should sprout in 10-16 days. Bottom heat will speed germination.",Sow seeds no more than 5mm (¼”) deep in moist soil. Space plants 45-60cm (18-24″) apart.,"The plant is tolerant to drought, but keep the soil moist during very hot weather. Cut back to the ground after flowering. This plant makes an excellent ground cover or lawn replacement, and will bloom even when it has been mowed. Prunella grows 5-30cm (2-12"") tall. Add it to lawns or wildflower blends. Plant at 21-42g per 1000 square feet - or 2-4 lb per acre.",
Ratibida,Flower,"Start transplants in a cold frame in early spring, or direct sow in May to June. Starting indoors requires vernalization – wrap planted pots in plastic and store in the refrigerator for one week, and then provide 20°-24°C (68°-75°F). Do this step 4-6 weeks before planting out. Seeds will germinate in 7-42 days.",Barely cover the seeds with soil. Transplant or thin to stand 30-60cm (12-24″) apart.,"Stake tall growing plants in windy gardens. Ordinary, well-drained soil will do. Ratibida is susceptible to foliar diseases like powdery and downy mildew, fungal spots, and leaf smut. To avoid these, mulch around the plants and only water in the morning, avoiding getting the leaves wet. These plants are highly resistant to heat and humidity, and they are suitable for xeriscaping.",
Scabiosa,Flower,"Sow indoors 8 – 10 weeks before planting out. Sow outdoors in early spring, when a risk of light frost is still possible. In mild winter areas, seeds can be sown in the fall.",Barely cover the small seeds. Space plants 30-45cm (8-12″) apart.,"Ideal pH: 7.0-8.0.Deadhead regularly. Grow in average, humus-rich well drained soil.",
Sisyrinchium,Flower,"Germination can be slow, and the seeds benefit from vernalization. Sow pre-moistened flats and seal them in plastic bags. Refrigerate for two to three weeks. Then move the flats outdoors to a shady location after all threat of frost has passed. Transplant as seedlings appear.","Sow seeds 2mm (1/8″) deep. Germination can take 30 to 180 days, so be patient.","Ideal pH: 6.5 – 7.8.Transplant after last frost into average, well drained soil. Sisyrinchium grows well in most situations, but it excels in moist, well-drained, fertile soil.",
Snapdragon,Flower,"Start snapdragons indoors, 8-10 weeks before planting out. Transplant out after last frost. Direct sowing is less reliable. Provide bright light and a soil temperature of 12°C (55°F). Seeds should sprout in 10-21 days.","Sow on the surface of a sterilized seed starting mix. To avoid damping off (to which snapdragons are somewhat prone), increase ventilation, use a layer of vermiculite on top of the soil, and water only from below. Transplant out once daytime temperatures are consistently above 10°C (50°F) and space 30cm (12″) apart.","Grow these easy sub-shrubs in rich, soil with a neutral pH. Pinch back young plants once 6 leaves have appeared for bushier mature plants. Feed lightly twice, before any flowers appear. Deadhead often. If flowering seems to subside, cut back dramatically, and then feed and water generously.",
Soapwort,Flower,"Start indoors in peat or coir pots 8-10 weeks before planting out. Alternately, direct sow in early spring or early autumn. For best results, place the seeds on the surface of pre-moistened soil, and tuck inside a plastic bag. Refrigerate for three weeks, and then provide bright light and a soil temperature of 21°C (70°F). Germination should occur in 10-21 days.",,"Transplant into dry, rocky soil in full sun or partial shade at 10-20cm (4-8”) apart. Water only during very dry spells, and do not fertilize. Cut back after blooming to keep plants compact. Saponaria plants do not transplant well, and they dislike wet soil over winter.",
Sunflower,Flower,"Direct sow repeatedly after the last frost date. Starting indoors is possible, but does not gain much time. If sunflowers are allowed to get root-bound, they will lack stability at transplant time, and will require staking. Optimal soil temperature for germination: 21-30°C (70-85°F). Seeds should sprout in 10-14 days.","Sow seeds 5mm-1cm  (¼-½”) deep. Space dwarf varieties 15cm (6″) apart, but give the giants lots of room at 1m (3′) between plants.","To grow really big plants with really big flowers, enrich the soil with organic matter and incorporate 2 cups of balanced organic fertilizer per 3m (10′) of row, and irrigate regularly. When the plants are 30cm (12) tall, dissolve 5ml (1 tsp) of borax (for boron) in 350 ml (12 fl oz) of water and spread the solution over 5m (15′) of row. Be careful not to over-apply this solution. This application of boron will produce bigger seeds and flower heads. Do not apply boron to other garden plants. When the back of the flower head turns yellow, it is ready to be cut from the plant.",
Sweet Pea,Flower,"Sow indoors 6-8 weeks before the last average frost date for your area. Or direct sow outdoors in early spring, while the soil is still cool and light frost is still possible. Plants are strongest from an early, indoor sowing. Sweet peas can also be direct sown in the fall where winters are mild.","Sow seeds 1cm (½”) deep. If starting indoors, chip seeds or soak them in warm water for 24 hours. Use a seed inoculant for the best results. Maintain a soil temperature of 12-18°C (55-65°F). Seeds should germinate in 10-20 days.","For best results, prepare the sweet pea bed the previous fall. Cultivate the soil to 45cm (18″) deep, incorporating a generous amount of finished compost. Also dig in bone meal. At transplant time, dig ¼ cup balanced organic fertilizer into the soil beneath each plant. Space vines at 15cm (6″) and provide trellis support. Mulch around plants to keep the soil as cool as possible, and water during dry weather. Keep plants picked to prolong the blooming period.",
Tobacco,Flower,"Sow indoors 6-8 weeks before last frost, or direct sow outdoors any time after the risk of frost has passed. Transplant after last frost.","Sprinkle seeds on the surface of the soil, and keep moist until germination in 10-20 days.","Water during hot, dry spells. Deadhead regularly to maintain a neat appearance and encourage further blooming. Stake in windy, exposed gardens. Remove any growth that comes under attack by aphids, or dislodge them with a blast from the hose.",
Viola,Flower,"Start indoors 10-12 weeks before planting out. For spring planting after last frost, that means up to 3 months growing time indoors. Otherwise, sow direct outdoors in summer to early autumn. For winter-flowering pansies in Zones 7-9, start seeds in mid to late June. For Direct sow in autumn or early spring. This variety benefits from a long exposure to cool soil.","Even though the seeds are tiny, they need to be sown 5mm (¼”) deep. Keep the soil at 18-25°C (65-75°F), in complete darkness until they germinate in around 14 days. Then provide bright light to keep plants compact. Space at 15-23cm (6-9″) in the garden.  Barely cover the tiny seeds. Sow in flats sunk into the ground against a north-facing wall, and cover with glass or plastic. Remove cover when seedlings emerge. Germination can take up to 50 days, so be patient.","After germination, pansies and violas are easy. Fertilize once or twice in early growth and provide a mulch around plants to keep roots cool as weather warms. Deadhead to prevent self-sowing, particularly with Johnny-Jump-Ups. Transplant after last frost or in the autumn where winters are mild, spacing at 15-30cm (6-12”) apart. Grow in partial shade, or in full sun where summers are cool. This variety prefers rich, moist, well-drained soil with a pH of 5.5-7.0. Add well-rotted manure at transplant time.",
Wildflower,Flower,"Try to direct sow wildflower seeds during the period two weeks before, and eight weeks after, your last average frost date. Sowing when there is some risk of minor frost may improve germination. Wildflower seeds can also be sown in the autumn, but a certain percentage of seeds to may be lost to water, birds, and animals. To make the most of the annual species, direct sow in early spring."," If there are already no plants (including weeds) growing in the planting site, there may be a problem with the soil. Possible issues may be soil fertility, lack of drainage, or the need for soil amendments to improve texture. In such spots (eg, beneath a cedar tree), few plants will thrive, including wildflowers. Remove as much existing vegetation as possible through pulling or tilling under in order to minimize competition. Loosen the soil by scraping, raking, or tilling. Wildflower blends will not usually take if planted into existing lawn because the thatch prevents their contact with soil. In small areas, seeds can be scattered by hand. In larger areas, you may want to employ a lawn spreader or some other mechanical means. We recommend adding 1-2 parts clean, dry sand to 1 part wildflower seeds which will help the seeds spread evenly. Do not use beach sand, as it usually contains salt. It may be wise to spread most of the seed, but to save some for filling in bald spots at a later date. Seeds must come into contact with the soil in order to germinate. Do not bury seeds more than 2-3 times their thickness. Aim for a planting density of 70 seeds per square foot. 90g of seeds will cover 1,000 ft². Use 4kg per acre. 500g covers about 5,500 ft². If seeding an area where site preparation and weeding are not possible, double this rate.","Keep the seeded area as evenly moist as possible to help the seeds germinate and the young seedlings become established. Weeds need to be kept under control. Once they are growing, most mixes will not require additional water except in long periods of hot, dry weather. All of our mixes should re-grow for several years, but will eventually benefit from re-seeding. In late summer, many of the components will produce seed heads that can be harvested and replanted the following spring.",
Yarrow,Flower,"Sow indoors 8-10 weeks before planting out after the last frost date. Transplant or direct sow in early spring or early autumn. Optimal soil temperature for germination: 15-18°C (60-65°F). Seeds can take 10 to as long as 100 days to sprout, so be patient. Bottom heat speeds germination.","Sow on the surface of the soil, under bright lights if starting indoors. Transplants can go out while the soil is still cool and there is still some risk of light frost. Space transplants at 30-60cm (12-24″) apart.","Ideal pH: 5.5 to 7.0.Yarrow is a tough plant that is suitable for , and it will adapt to pretty much any soil. For best results, grow in a loamy, well drained soil. Divide plants every 3-4 years. Cut plants to ground level in autumn.",
Zinnia,Fower,"Direct sow after last frost. Zinnias don’t transplant well, but can be started indoors, if necessary, in peat or coir pots, 6-8 weeks before planting out. Maintain a soil temperature of 21-26°C (70-80°F). Seeds should germinate in 5-24 days.","Just cover Zinnia seeds, and aim for a final spacing of 25-30cm (10-12″) between plants.","Depending on the variety, it takes about two months after sowing for the first flowers to appear. Take regular cuttings of Zinnia stems to enjoy indoors, starting mid-summer right into the fall. Cutting encourages the production of new flowers and seems to stimulate the plants for greater vigour. Watch for signs of powdery mildew on the leaves, usually in late summer. Try to avoid overhead watering to prevent mildew.",
Gaillardia,Fruit,"Direct sowing is easiest, and is done after last frost, or in the autumn in places where winter is mild. They can also be sown indoors 4-6 weeks before last frost. These would be transplanted out once daytime temperatures are consistently above 10°C (50°F). Seeds will germinate in 7-20 days. If starting indoors, provide bright light and a soil temperature of 21°C (70°F).",Sow on the surface of the soil. Transplant or thin to stand 15-30cm (6-12″) apart.,"Feed once, just as flowering begins, and top-dress with well-rotted manure once in summer. Deadhead regularly. Water regularly during dry spells, keeping leaves as dry as possible – this can be done in the early morning, so leaves dry off by noon. Gaillardia will self sow.",
Berry,Fruit,,,,
Goji Berry,Fruit,"Sow indoors about 6 to 8 weeks before the last frost. It’s important to cultivate strong seedlings, so once the seeds sprout, use generous artificial light.","Sow 2 to 3 seeds in each pot, about 5mm (¼”) deep. Use a sterilized seed starting mix, and do not add fertilizer. Keep soil moist until seeds germinate, and then place under bright lights. After the third true leaf emerges, transplant each seedling on to its own individual pot. Gentle hardening off of seedlings is essential in order to avoid transplant shock.","Ideal pH: 6.8 - 8.1.Goji is a shrubby plant that can, in time, grow 1-3m (3-10′) tall. Growers space Goji plants 60cm (24″) apart in rows that are 2m (6′) apart. Spaced this way, 15 plants in a 30 foot row can produce up to 100 lbs of berries in a year. Goji is self pollinating, so even a single plant will produce fruit.Goji is unusual in that it prefers relatively infertile, slightly alkaline soil. Goji reacts poorly to fertilizer and manure, so if growing in a large container, use simple top soil with some perlite mixed in for drainage. Avoid peat-based soils.If severe winter weather is expected, it is wise to mulch around the bases of Goji plants, or move container plants into a cool but frost free area such as a garage.",
Strawberry,Grass,"Sow indoors in the winter. An earlier start may result in berries the first year. Start any time between December and the beginning of February. After that time, they will still produce plants, but berries may not be produced during the first season. Transplant out at least 3 weeks after last frost. Strawberry seeds will germinate at any time of the year if some simple steps are taken.","Germination is the trickiest aspect to growing strawberries. Be patient, and try the tricks below.Tuck strawberry seed packet inside a sealed plastic bag or airtight container and place in the refrigerator freezer (not deep freeze) for 3-4 weeks. After removing the bag or container,  until it (and its living contents) have reached room temperature. This may take several hours. Err on the side of caution. Opening the package too quickly may result in water condensing on the cold seeds, and this will reduce your chances of success.Once the sealed package has “thawed” to room temperature, the seeds are ready to plant. Sow the seeds on the surface of pre-moistened, sterilized seed starting mix in trays or small containers. Place these on a piece of felt or other thick cloth that has its end sitting in water. The idea is to wick up water from below so that the seedling medium stays constantly and evenly damp until germination.An alternative method is to sow strawberry seeds on the surface of moistened soil in a germination tray (or in small pots). Tuck the tray or pots inside a sealed plastic bag, and store in the refrigerator for 3-4 weeks.Move the seeded trays under bright fluorescent lights at a constant temperature of 18-24°C (65-75°F).  work very well. Germination may take anywhere from 7 days to 6 weeks: Be patient. Once germination occurs, increase ventilation around the plants to prevent damping off.Once the seedlings develop their third true leaf, they can be gently transplanted into their own pots. Be sure to harden strawberry seedlings off carefully and gradually before transplanting outside.","Space transplants 60cm (24″) apart in rows 90-120cm (36-48″) apart. Ever-bearing varieties (such as ours) tend to produce fewer runners, and may produce more fruit if the runners are removed. In the first year of growth, it may be preferable to encourage runners, and let them fill in the spaces between transplants with new offspring plants.Grow strawberries in a well-drained, sandy loam that has been generously dug with organic matter such as finished compost or well-rotted manure. Dig ¼ cup complete organic fertilizer into the soil beneath each transplant. Keep soil moist, but not soggy. A mulch of straw around plants may help prevent the soil from drying out.",
Fescue,Herb,Sow in the spring or fall (fall is recommended) at a depth of 5-10mm (¼-½”). ,"Use Tall Fescue to overseed existing lawn at a rate of 1.8kg (4 lbs) per thousand square feet. Better yet, seed a new area, with no turf present, at 3.6kg (8 lbs) of seed per thousand square feet.",,
Basil,Herb,"Basil grows well in containers indoors at any time of year provided you can supply enough light. For outdoor growing, sow basil seeds throughout late spring for transplanting to the garden after the summer solstice. Or direct sow in early summer, once the soil has warmed up. Basil requires warm soil and full sun. Optimal temperature for germination: 21°C (70°F). Seeds should sprout in 5-10 days.","Sow seeds 1cm (½”) deep in sterilized seed starting mix. Basil is prone to damping off, so once seeds sprout, make sure they are adequately ventilated, and kept under very bright light. Thin to 20-25cm (8-10″) apart. Using bottom heat speeds germination.","Use any rich, loose, well drained soil. Once plants are 15cm (6″) tall, pinch out the growing tips to encourage really bushy growth prior to harvest. Watch for signs of flower buds forming in mid-summer, and pinch these off to promote more foliage. GerminationUsual seed life: 3 years.","Frequent harvesting will prolong the life of the plant. Basil leaves have the best flavour just before the plant flowers, and if you plan to preserve some of your basil or make a big batch of pesto, this is the best time to harvest. Flowering can be delayed by pinching or clipping off new flower buds.Tear basil rather than chop with a knife because chopping tends to bruise the leaves. Add basil to food just before serving so as to get the full aroma and effect. Cooking for any length tends to make the minty side of basil come to the forefront.Basil is best fresh, but can be preserved by drying or by freezing. To freeze, tear the leaves into small pieces and freeze small batches of them, with water, in ice cube trays. Once frozen, the cubes can be saved in zip-lock type bags and labeled for later use. This will preserve the fresh flavour of basil for up to four months."
Bergamot,Herb,"Sow indoors 6-8 weeks before the last frost, or direct sow in early spring when a light frost is still possible. Seeds can also be direct sown in the fall, as the first frost approaches. Optimal soil temperature for germination: 15-21°C (60-70°F). Seeds should sprout in 10-40 days. Bottom heat will speed germination.","Barely cover the tiny seeds with soil. Thin or space transplants 45-60cm (18-24″) apart. These vigorous perennials will grow in, closer together over time.","Any ordinary garden soil will work. Plant in full sun to partial shade. Where summers are long, plants are prone to mildew, so avoid overhead watering. Deadhead regularly to prolong the blooming period. These perennial plants spread by rhizome growth, and should be dug and divided every three years.","Pick the leaves as desired for fresh use in the kitchen. For drying, harvest leaves before the flowers open. Cut flowers for drying as soon as they’re fully open. Masses of tiered pink-purple blossoms grow from August until frost."
Borage,Herb,"Direct sow in mid- to late spring. Borage develops a delicate taproot, so it’s best direct sown where it is to grow. Borage does not transplant well. Optimal soil temperature for germination: 21°C (70°F). Seeds should sprout in 5-15 days.","Sow seeds 1cm (½”) deep, and thin to 60cm (24″) apart. Borage will get large and fill in spaces between plants.","Borage is an un-fussy, self-sowing annual. To avoid self-sowing, the flower heads need to be picked regularly. Borage does best in full sun in well drained soil. GerminationUsual seed life: 3 years.",Pick fresh flowers for freezing or drying for bouquets. Cut the fresh leaves during the summer to add to salads or spreads.
Catnip,Herb,"Sow seeds indoors in late winter, and transplant or direct sow in 2-6 weeks after the last frost date. Catnip can also be direct sown in the fall where it is to grow. Bottom heat will speed germination. Ideal temperature for germination: 21-27°C (70-80°F). Seeds should sprout in 10-20 days.",Sow on the soil surface or barely covered with perlite. Thin plants or transplant to 30cm (12″) apart. Keep seedlings well protected from cats.,"Catnip does very well in containers, raised beds, or borders in full sun to partial shade. The main challenge to growing it is protecting it from cats. After the main bloom, plants should be cut back hard to encourage a second bloom and tidy shape. GerminationUsual seed life: 5 years.","To save the summer catmint bounty, harvest when fully grown, and keep the plant picked regularly."
