Name,Category,Timing,Starting,Growing,Harvest
Fennel,Vegetable,Start indoors 4 weeks before the last frost date in individual peat or coir pots. Fennel dislikes root disturbance. Transplant (or direct sow rows) 4 weeks after last frost in succession to mid-summer. Ideal temperature for germination: 15-21°C (60-70°F). Seeds should sprout in 10-14 days.,"Sow seeds 1cm (1/2”) deep, a few seeds where each plant is to grow. Thin or space to 20-30cm (8-12”) in rows 45cm (18”) apart.","Ideal pH: 5.5-7.0. Rich, well-drained soil produces the best bulbs. Transplant when seedlings are 5cm (2″) tall. If raising transplants, do not disturb the roots, as this may cause plants to bolt. Keep well watered to ensure succulent bulbs and prevent bolting. GerminationDays to maturity: From direct sowing.In optimal conditions 80% of seeds will germinate. Usual seed life: 2 years. Per 100′ row: 240 seeds, per acre: 53M seeds.","Use a knife to slice the bulb from the root when it has thickened to 5cm (2″) or more across. If this is done carefully, smaller bulbs will sprout from the root later."
Kale and Collards,Vegetable,"Direct sow in early spring to mid-summer for summer to winter harvests. Or start indoors 4-6 weeks before the last frost, and transplant out as soon as the soil warms up. Optimal soil temperature: 10-30°C (50-85°F). Seeds should germinate in 7-10 days.",Sow 3-4 seeds 5mm (¼”) deep in each spot you where a plant is to grow. Thin to the strongest plant. Space 45-60cm (18-24″) apart in rows 75-90cm (30-36″) apart.,"Ideal pH: 6.0-6.8. Add lime to the bed 3 weeks prior to sowing. Kale likes well-drained, fertile soil high in organic matter. This plant prefers plentiful, consistent moisture. Drought is tolerable, but quality and flavor of leaves can suffer. Mix ¼ cup of complete organic fertilizer into the soil beneath each transplant, or use 1 cup beneath every 3m (10′) of seed furrow. GerminationDays to maturity: From transplant date.In optimum conditions, at least 80% of seeds will germinate.","Kale and collards can both be grown as a cut and come again crop for salad mixes by direct-seeding and cutting when plants are 5-8cm (2-3″) tall. They will re-grow. Or pick leaves from the bottom up on mature plants as you need them. In spring, the surviving plants start to flower, so eat the delicious flowering steps and buds."
Kholrabi,Vegetable,"Direct sow several times during the four to six weeks after the last frost date for a crop to mature starting in about 8 weeks. Sow again after mid-July to early August for fall and winter crops. Planting between mid-May and mid-July causes kohlrabi to mature in hot weather, resulting in inferior bulbs. In short season areas, start kohlrabi indoors in cell trays about 4 weeks before the last frost date and transplant out once day time temperatures are steadily above 10°C (50°F). Optimal soil temperature for germination: 10-30°C (50-85°F). Seeds should germinate in 7-10 days.",Sow seeds 5mm (¼”) deep with plants spaced 10-15cm (4-6″) apart in rows 30-45cm (12-18″) apart.,"Ideal pH: 6.0-6.8. Kohlrabi is a moderate to heavy feeder that does best in humus-rich soil amended with composted manure. Mix ¼-½ cup complete organic fertilizer into the soil under each plant. GerminationDays to maturity: From direct sowing.In optimal conditions, at least 80% of the seeds will germinate. Usual seed life: 3 years. Per 100′ row: 360 seeds, per acre: 104M seeds.","Spring-sown kohlrabi will get larger than tennis balls in fair soil, but if you pick them when they are still less than 5-8cm (2-3″) in diameter they will be sweet and tender. Fall-grown kohlrabi can grow larger yet stay tender. Kohlrabi is frost-hardy, and may last well beyond Christmas in mild winter areas."
Lettuce,Vegetable,"Lettuce grows best in cool weather in the spring and fall, but it can be grown in the summer, and all winter long in milder regions. Sow short rows every 2-3 weeks following the last average frost date for a continual harvest. Using a cloche, cold frame, or greenhouse over mid-late summer plantings can extend the harvest period right into winter. Optimal soil temperature for germination: 10-22°C (50-72°F). Seeds should sprout in 7-15 days, depending on conditions. Lettuce seeds don’t sprout easily when the soil temperature is over 22°C (72°F) in summer. Get around this by sprouting them indoors in a cool area, or pre-sprout by sprinkling seeds on a damp paper towel and placing it in a plastic bag in the fridge for a few days. In hot weather most lettuce goes to seed rapidly, so have new plantings ready to go, and watch for ""good resistance to bolting"" in the product description.","Direct sow or start indoors and transplant. Sow seeds 5mm (¼”) deep, or on the surface of the soil where the soil can be kept evenly moist. Space or thin heading lettuce to 30cm (12″) apart. Space or thin looseleaf varieties to 20-25cm (8-10″) apart. Space rows for all types 45-90cm (18-36″) apart. Babyleaf lettuce can be planted quite densely, as it is harvested at an immature size. Sowing babyleaf lettuce seeds closely together in narrow rows makes harvesting simpler.: A number of our lettuce seeds are pelleted for machine planting. The white clay ball that covers each seed makes them easier to handle and easier to see when planted. While most lettuce seeds need to be barely covered (or sown on the surface of the soil), pelleted seeds need to be buried by about 1cm (1/2″). Please keep your newly sown pelleted seeds evenly moist – use more water than with conventional seeds. If the soil is allowed to dry out, the clay pelleting material can wick water away from the seed, causing uneven or lower germination.","Ideal pH: 6.0-6.5. Aim for a soil with ample drainage and lots of organic matter. Add compost and lime at least 3 weeks prior to planting. One cup of balanced organic fertilizer per 3m (10′) of row will give adequate nutrition. Seedlings should be hardened off by reducing water and putting the plants outdoors 2 or 3 days before transplanting. This will help to prevent transplant shock and premature bolting. Regular watering is essential to prevent leaves from developing a bitter taste.  GerminationDays to maturity: From direct sowing. Most varieties will be ready for harvesting as baby leaves in half the days shown on the packet.In optimal growing conditions at least 70% of seeds will germinate. Usual seed life: 3 years. Per 100′ row: 240 seeds head lettuce/1.2M seeds leaf type, per acre: 58M seeds head lettuce/348M leaf type.","Pick individual leaves or wait and harvest full heads. Mature summer lettuce stays in prime eating condition only a short time, so harvest promptly and keep planting. In fall and winter the plants stay in good harvest condition longer."
Microgreens,Vegetable,"Timing microgreens depends on the individual kinds of greens you will be growing. Cress grows really fast, and can be harvested a few days after sowing. Carrot seeds can take as long as 2 to 3 weeks to germinate, so you should expect to allow extra time.Microgreens can be grown at any time of the year as long as you can supply enough light.","Follow the planting instructions for each variety of seeds. For instance, some seeds prefer to be sown on the surface of the soil, while others need to be covered. We recommend using sterilized seed starting soil in shallow trays that have drainage holes at the bottom. You could try growing microgreens in 12-cell plug inserts that have been inserted into seedling germination trays. You can also grow microgreens in recycled plastic containers or clamshell packaging, as long as you poke some drainage holes in the bottom. Using a seedling warmer will increase the speed of germination, but it is not strictly necessary.Spread the sterilized soil to a depth of only 2-3 inches. You’ll be harvesting the baby seedlings, so they don’t need a lot of room to grow roots.Sow microgreen seeds fairly densely, a little less dense for large seeds like sunflowers. Once your microgreen seeds have been planted, mist the whole area. You want to keep the soil moist like a wrung out sponge, but not sitting in water. Keep your mist sprayer handy, and spritz the soil regularly. The nice thing about using seedling germination trays is that you can take a second tray and invert it over the planted tray. This traps moisture inside, and prevents rapid evaporation.","As soon as the first sprout is visible above the soil, remove the tray from the seedling warmer (if using), and remove the cover (if using). Bright light is essential for growing microgreens. From late spring to early autumn, microgreens can be grown outdoors under daylight conditions. But indoors, you will need to provide some kind of supplemental light, particularly in the short, dim days of winter. The Growlight Garden is one of the best microgreen growing systems we have found. It even has a self-watering mechanism, which makes the whole process much easier. But any way you can provide light from T5 fluourescent tubes or other grow lights will work. Aim for full spectrum lights.This bright light will help keep your microgreens short and stout. When light is insufficient, the sprouts will grow long and spindly.","Microgreens can be pulled from the soil and rinsed until all the soil particles have washed away. They can be enjoyed whole, roots and all. Or simply trim them with scissors and dispose of the used soil in your compost.Microgreens are intended to be harvested when the first leaf pair (the cotyledon, or seed leaf) opens fully and turns green. This is the point at which your microgreens will be richest in nutrients. However, you can also let the seedlings continue to grow and harvest them as needed. Be aware that the longer they are left to grow the more roots will also develop in the soil."
Mustard,Vegetable,Mustards are cool season plants that grow quickly and then bolt. Direct sow with frost protection as early as late winter or without protection from early to late spring. Sowing short rows every 3 weeks allows for a continuous harvest of both baby leaves and full sized plants. Sow again in late summer for late fall and winter harvests. Optimal soil temperature: 21°C (70°F). Seeds should sprout in 5-10 days.,"If growing to full size, sow 3-4 seeds in each spot you want a plant to grow. Sow 5mm-1cm (¼-½”) deep and thin to the strongest plant, spaced 10-15cm (4-6″) in the row. All mustards can be grown in containers for baby salad greens. Sow these as you would mesclun mixes, with seeds spaced as near as possible to 1cm (½”) apart.","Ideal pH: 6.0-6.5. One cup of complete organic fertilizer will provide nutrition for 3m (10′) of row. Water regularly. Expect mustards to bolt in hot weather. Provide protection in winter by using a cloche or heavy row cover. At all other times, plan on growing fast and harvesting fast, like spinach. Planting short rows every two weeks works best for the home garden for a constant harvest. GerminationDays to maturity: From direct sowing. In optimal conditions at least 70% of seeds will germinate. Usual seed life: 3 years. Per 100′ row: 400 seeds, per acre: 174M seeds.","Cut individual leaves, or the whole plant at whatever stage of maturity you desire. Young leaves tend to be more tender and less powerfully flavoured as mature leaves. Some varieties will develop a slight bitterness in fully mature leaves. The leaves can be blanched (or run through a food processor) and then frozen, or even dried and flaked for soup mixes. But the plants are so cold hardy, fresh leaves should be available to the determined gardener 12 months of the year. Whole plants can also be pickled for long term storage."
Pac Choi and Choi Sum,Vegetable,"All are cool season plants that grow quickly and then bolt. Direct sow with frost protection (a cloche or heavy row cover) as early as late winter, or without protection from four weeks before the last frost date to eight weeks after. Sowing short rows every 2-3 weeks allows for a fairly constant harvest time. Sow again in late summer, and provide frost protection as the first frost date approaches.",Sow 3-4 seeds 5mm-1cm (¼-½”) deep in each spot you want a plant to grow. Thin to the strongest plant at a spacing of 15-20cm (6-6″) between plants in rows 30-45cm (12-18″) apart.,"Ideal pH: 6.0-6.8. 1 cup of complete organic fertilizer will provide sufficient nutrition to 3m (10′) of row. Choi Sum is harvested just before it flowers, so keep a close watch on each row. Pac Choi can be harvested at any stage, but if you want full-sized plants, watch for signs of bolting. Flower buds will appear at the centre of each plant, and a stem will form quickly as the plant turns from urn-shaped into a tall cone. Harvest as quickly as possible once flower buds are visible. Keep plants well-watered throughout their growth. GerminationDays to maturity: From direct sowing.In optimal conditions at least 70% of seeds will germinate. Usual seed life: 3 years. Per 100′ row: 260 seeds, per acre: 114M seeds.","Use a sharp knife to cut the plants at ground level when they are ready to harvest. They will not grow back like some other crops, so plant several short rows every couple of weeks for a longer harvest."
Parsnip,Vegetable,Direct sow from the last frost date to mid-summer. Optimal soil temperature for germination: 10-25°C (50-75°F). Seeds take 14-21 days to germinate.,Sow seeds 5mm-1cm (¼-½”) deep. Cover seeds with compost and/or put row cover over planting area to shade the soil and conserve moisture. Thin to 7-10 cm (3-4″) apart in rows 45-60cm (18-24″) apart.,"Ideal pH: 6.0-6.8. Prepare ground as for carrots, digging deeply to loosen soil prior to planting For even longer parsnips, you can dig or form holes 60cm (24″) deep. Weed carefully and keep watered. Contact with parsnip leaves causes a rash in some people, so harvest and weed with long sleeves and gloves. GerminationDays to maturity: From direct sowing.In optimal conditions at least 60% of seeds will germinate. Usual seed life: 1 year. Per 100′ row: 440 seeds, per acre: 128M seeds.",The flavour of parsnips is best after a couple of good frosts. Dig parsnips from late summer into the winter as needed. Protect from freezing in the soil with a thick straw mulch if it is a cold winter. Parsnips keep better in well-drained soil. The average family will be well supplied with a 6m (20′) row.
Pepper,Vegetable,"Peppers need plenty of time to mature before they will bloom and set fruit. Start indoors six to eight weeks before the last frost date, and grow under bright lights. Transplant only when weather has really warmed up. Night time low temperatures should be consistently above 12°C (55°F) before hardening off pepper plants and transplanting outdoors. Soil temperature for germination: 25-29°C (78-85°F). Seeds should sprout in 10 – 21 days.","Sow indoors 5mm-1cm (¼-½”) deep. Keep soil as warm as possible. Seedling heating mats speed germination. Try to keep seedlings at 18-24°C (64-75°F) in the day, and 16-18°C (61-64°F) at night. Before they become root-bound, transplant them into 8cm (3″) pots. For greatest possible flower set, try to keep them for 4 weeks at night, about 12°C (55°F). Then transplant them into 15cm (6″) pots, bringing them into a warm room at night, about 21°C (70°F).","Soil should have abundant phosphorus and calcium, so add lime and compost to the bed at least three weeks prior to transplanting. Mix ½ cup of balanced organic fertilizer beneath each plant. Though peppers will tolerate dry soil, they will only put on good growth if kept moist. Harden off before planting out 30-60cm (12-24″) apart. Five gallon containers also work well, but require good drainage and regular irrigation. Using plastic mulch with a cloche can increase the temperature by a few degrees. Pinch back growing tips to encourage leaf production. This helps shade the developing fruits and prevents sun-scald in hot summers. GerminationDays to maturity: From transplant date.In optimal conditions at least 65% of seeds will germinate. Usual seed life: 2 years.","When the fruit is large and firm it is ready to pick. Or wait for the fruit to ripen further turning red, yellow, brown, or purple. The sweetness and vitamin C content go up dramatically as the fruit changes colour. If you pick green, the total numbers of peppers harvested will increase. Fruit that sets after late August will not usually develop or ripen. Pull out the entire bush just before the first frost and hang it upside down in a warm, dry place to ripen hot peppers. "
Pole Bean,Vegetable,"Direct sow from late spring to early summer. Try to plant during a warm, dry spell. Soil must be warm – if it is not warm enough, seeds may rot, especially our untreated seeds. Optimal soil temperature: 21-32°C (70-90°F).","Seeds can be started indoors, or sowed directly. Set seeds 7-10cm (3-4″) apart and 3.5cm (1½”) deep at the base of a support. Plants will climb by twining around almost anything. Try rough poles, lumber, re-bar, or build a strong trellis 2-2.5m (6-8′) tall. Seeds will sprout in 8-16 days, depending on soil conditions. ","Ideal pH: 6.0-6.5Well drained, warm soil in full sun is best. Use 1 cup of balanced organic fertilizer for every 3m (10′) of row. Too much nitrogen in fertilizer or manure is often the cause of poor pod set and delayed maturity. If beans flower but do not set pods, the cause can be zinc deficiency. Try spraying the plants with kelp based fertilizer. GerminationDays to maturity: From direct sowing.In optimal conditions at least 75% of seeds should germinate. Usual seed life: 3 years. Per 100′ row: 400 seeds. Per acre: 43.5M seeds.","Because pole beans are always climbing, there are always beans at different stages of maturity. It is important to keep picking regularly so the plant does not fully mature seeds and stop producing new pods. If pods get fat with seed, the plant will stop flowering. The smaller the bean, the more tender they are."
Quinoa,Vegetable,"Direct sow in spring, while night temperatures are still cool. Night time temperatures should be consistently above 10°C (50°F). Optimal soil temperature for germination: 18-24°C (65-75°F). Seeds should germinate in 4-10 days.","Sow 5mm (¼”) deep, 10 seeds per 30cm (12″), and thin to 25-35cm (10-14″) between plants. If growing for baby leaf production, plants can be spaced more closely.","Ideal pH: 6.0-7.5. Use a well-drained, loamy soil with added organic matter in the form of well-rotted compost or manure. Keep weeded, but otherwise quinoa is drought tolerant and undemanding. It’s a great plant for xeriscaping, and the tall plants look good at the back of a floral border. GerminationFrom direct sowing.In optimal conditions at least 70% of seeds should germinate. Usual seed life: 3 years. Per 100′ row: 160 seeds, per acre: 42M seeds.","Harvest any time after seeds have changed from green to their calico colours, even after light frost. Read more about ."
Radiccio,Vegetable,"Sow after the last frost date and again in mid-summer to take advantage of the fall growing season. Optimal soil temperature: 10-22°C (50-72°F). Seeds sprout in 2-15 days, depending on conditions. In hot weather plants may go to seed quickly, so have new plantings ready to go.","Either direct seed or start indoors and transplant. Sow seeds 5mm (¼”) deep, and thin or transplant to allow 30-45cm (12-18″) between plants in rows 30-45cm (12-18″) apart.","Ideal pH: 6.0-6.5.Enrich soil with compost and add ¼ cup balanced organic fertilizer into the soil beneath each transplant. Rapid, continuous growth is essential for good yields and high quality. Regular watering is essential.Fall plantings can be protected from rain by putting a cloche over them. Endive heads can be blanched to reduce bitterness by placing a cardboard or plastic disc on top. Radicchio requires a good supply of phosphorus and potassium, but will not head and may bolt if there is too much nitrogen available. Days to maturity shown are from date of direct sowing. If transplanting, subtract 10-15 days. GerminationDays to maturity: From direct sowing.In optimal conditions at least 65% of seeds will germinate. Usual seed life: 3 years. Per 100′ row: 140 seeds, per acre: 40.6M seeds.",Use as a cut and come again crop or let the heads develop and cut at ground level. Many will grow back.
Radish,Vegetable,Radishes can be grown all season but they’re easiest when sown just after the last frost date and again at the end of summer and into the fall. Optimal soil temperature: 18-24°C (65-75°F). Seeds should sprout in 5-7 days.,"Sow seeds 5mm (¼”) deep, 25 seeds per 30cm (12″) in rows spaced 30-45cm (12-18″) apart, and thin to 6-12 plants per 30cm (12″).","Ideal pH: 6.0-6.8. Radishes are moderate to heavy feeders. Best in rich, loamy soil amended with composted manure. Add 1 cup of complete organic fertilizer for every 3m (10′) of row for background fertility. Lime beds the previous fall. The real secret to growing this little vegetable is speed. Sow a short row frequently, thin them quickly, keep them watered, eat them quickly, and sow some more. GerminationFrom direct sowing.In optimal conditions at least 80% of seeds will germinate. Usual seed life: 4 years. Per 100′ row: 1.2M seeds, per acre: 522M seeds.",Harvest promptly when radishes are the size of large marbles. The leaves and developing seedpods are also tasty.
Rutabega,Vegetable,Direct sow rutabaga seeds during the period three weeks before or after the summer solstice. Optimal soil temperature: 18-21°C (65-70°F). Seeds should sprout in 7-15 days.,Sow seeds 5mm-1cm (¼-½”) deep in rows 60-75cm (24-30″) apart. Thin seedlings to 15-20cm (6-8″) apart in each row.,"Ideal pH: 6.0-6.8. Rutabagas are moderate to heavy feeders that do best in rich, loamy soil amended with composted manure. Add 1 cup complete organic fertilizer beneath each 3m (10′) of row. Lime beds several weeks before planting. Rutabagas appreciate lots of organic matter in the soil. Water generously in hot, dry weather. GerminationDays to Maturity: From direct sowing.At least 60% of seeds should germinate in optimal conditions. Usual seed life: 4 years. Per 100′ row: 300 seeds, per acre: 65.4M seeds.","Pull up rutabagas when they are larger than tennis balls. Store in paper bags in a cool, dry place. Storing in dry sand or peat moss may conserve moisture and freshness. Otherwise, leave in the ground for fall harvesting. Rutabaga leaves are also tasty and nutritious."
Ryegrass,Vegetable,"In Zone 6 or warmer, it makes an excellent fall cover crop, and will hold soil in place over winter. In Zone 5 or cooler, it’s better to sow mid-summer to early fall for spring tilling.","Sow seeds 2-4cm (1-1½"") deep.","After its burst of spring growth, turn ryegrass under or cut it back before it reaches 30cm (12"") tall. Allow three weeks after tilling before planting the next crop. Annual ryegrass can produce 4000-8000 lb of dry matter per acre, and hold up to 60 lb of Nitrogen per acre. It works particularly well in orchards and vineyards as a 50/50 mix with crimson clover.",
Salad Greens,Vegetable,Seed every three weeks from just before the last frost date until the end of summer for a continuous harvest. Provide frost protection with a cloche or heavy row cover when frost looms in the fall. Many mesclun types and mixes will continue to grow all winter where winters are mild.,"Plant in a block or in a wide row. Sprinkle the seeds evenly over prepared, moist soil. Try to space seeds about 1cm (½”) apart. Cover lightly with soil, and firm them in. Four grams of seed will plant a 12m (40′) row that is 7cm (3″) wide, so don’t plant the whole packet at once. For container growing, choose containers that are at least 10cm (4″) deep. Wider is better. The most common mistake is over-planting.","Ideal pH: 7.0 Moderately fertile soil – particularly if you’re planning multiple harvests. Dig in 1 cup of complete organic fertilizer for every 3m (10′) of row. For containers, use peat or coir based mix with compost added. Water regularly. If growth slows after harvest, use a bit of kelp or fish based fertilizer to provide a boost of nutrition for the next growth spurt. GerminationDays to maturity: From direct sowing. ","There are two methods of gathering salad greens. You can use scissors to cut everything about 2-5cm (1-2″) from the ground, when the plants are about 10-15cm (3-4″) tall. Or, you can pick individual leaves as they’re needed. The first cutting may contain more brassicas than lettuces (arugula, mizuna) but if you cut the mix back when the leaves are still small, the lettuce will catch up. The salad greens will regrow for a second harvest in another 2 or 3 weeks."
